{
  "$schema": "../../schemas/lexical_index_manifest_v1.schema.json",
  "average_document_length": 118.725900116,
  "bm25_b": 0.75,
  "bm25_k1": 1.2,
  "canonical_gold_file": "data/gold/mit_60001/chunks.jsonl",
  "canonical_gold_manifest_file": "reports/08_chunking/canonical_gold_manifest.json",
  "canonical_gold_manifest_sha256": "1fad01e0ed7f62cc23b3ef744a3d462f286970cf198836a35ec3498b27f207ee",
  "canonical_gold_sha256": "c03abf002c29b784d191eb393670da27b80fed8e0e18798f113d7ff8b7daf432",
  "chunk_count": 861,
  "chunk_id_order_sha256": "3d1d9d68fd8c9039d2a30ffe92933bb4e71c6488f8a60598998749945fa895db",
  "dense_index_content_sha256": "6e78f39257b7cc5defebd6740aab2dc1a4c202165b073f7a740ee5a5d7c46805",
  "dense_index_manifest_file": "reports/09_embedding/embedding_index_manifest.json",
  "dense_index_manifest_sha256": "4e8d277f630eff2c1a4b8e7721f449400e13f7e2c9fee4d99183270cc6ca388c",
  "dense_index_run_id": "mit60001_index_558e4d6e873847dd",
  "dotted_identifier_expansion": true,
  "index_backend": "exact_bm25_inverted_index_v1",
  "index_created_at_utc": "2026-08-14T13:43:50Z",
  "index_run_id": "mit60001_lexical_c8b5a0f1c77162b5",
  "index_version": "mit60001_bm25_v1",
  "lexical_index_file": "data/indexes/mit_60001/lexical_index.json",
  "lexical_index_sha256": "4fd1595a30ee85133bc6395d52278d2f5f2d9398c0c420d2c35031edb8e221f7",
  "lowercase": true,
  "maximum_document_length": 171,
  "minimum_document_length": 37,
  "posting_entry_count": 57804,
  "python_version": "3.12.10",
  "query_unique_tokens": true,
  "schema_version": "lexical_index_manifest_v1",
  "scope_version": "mit_60001_fall_2016_v1",
  "score_dtype": "float64",
  "selected_chunking_config_id": "semantic_cosine_wp240_v1",
  "stemming": false,
  "stopword_removal": false,
  "token_pattern": "[A-Za-z_][A-Za-z0-9_]*(?:\\.[A-Za-z_][A-Za-z0-9_]*)*|\\d+(?:\\.\\d+)?|==|!=|<=|>=|//|\\*\\*|[+\\-*/%<>=]",
  "tokenizer_version": "mit60001_python_lexical_tokenizer_v1",
  "total_token_count": 102223,
  "validation_error_count": 0,
  "validation_status": "passed",
  "video_count": 38,
  "vocabulary_size": 3334
}
